{
  "specversion": "1.0",
  "id": "evt_20260627_003",
  "source": "matrix://notyet.local/#agent-intake/$evt_20260627_003",
  "type": "com.notyet.agent.task.created",
  "subject": "task_20260627_001",
  "time": "2026-06-27T04:05:00Z",
  "datacontenttype": "application/json",
  "workspace_id": "ws_carpet",
  "task_id": "task_20260627_001",
  "trace_id": "trace_20260627_001",
  "actor": {
    "type": "human",
    "id": "@yet:notyet.local"
  },
  "created_at": "2026-06-27T04:05:00Z",
  "idempotency_key": "matrix:$evt_20260627_003",
  "data": {
    "goal": "Add schema baseline and contract tests.",
    "context": "Analysis-stage task for Matrix Codex Capability Runtime.",
    "scope": {
      "allowed_paths": [
        "schemas/**",
        "fixtures/**",
        "tests/contracts/**"
      ],
      "forbidden_paths": [
        "apps/**",
        "workers/**"
      ]
    },
    "acceptance_criteria": [
      "Valid fixtures pass schema validation.",
      "Invalid fixtures fail schema validation."
    ],
    "proof_requirements": [
      "pnpm test:contracts exits 0."
    ],
    "risk": "low",
    "requested_capability": "spec.scope"
  }
}
