{
  "specversion": "1.0",
  "id": "evt_20260627_021",
  "source": "runtime://incident-monitor",
  "type": "com.notyet.agent.incident.created",
  "subject": "incident_20260627_001",
  "time": "2026-06-27T04:21:00Z",
  "datacontenttype": "application/json",
  "workspace_id": "ws_carpet",
  "trace_id": "trace_20260627_001",
  "actor": {
    "type": "system",
    "id": "runtime_incident_monitor"
  },
  "created_at": "2026-06-27T04:21:00Z",
  "idempotency_key": "incident:incident_20260627_001",
  "data": {
    "incident_id": "incident_20260627_001",
    "severity": "error",
    "category": "projection_impersonation",
    "summary": "Matrix sender attempted to submit a Runtime-owned projection event.",
    "related_event_id": "$matrix_event_001",
    "related_event_type": "com.notyet.agent.proof.submitted"
  }
}
