{
  "specversion": "1.0",
  "id": "evt_20260627_020",
  "source": "runtime://capability-router",
  "type": "com.notyet.agent.capability.selected",
  "subject": "task_20260627_001",
  "time": "2026-06-27T04:20:00Z",
  "datacontenttype": "application/json",
  "workspace_id": "ws_carpet",
  "task_id": "task_20260627_001",
  "trace_id": "trace_20260627_001",
  "actor": {
    "type": "runtime",
    "id": "capability_router"
  },
  "created_at": "2026-06-27T04:20:00Z",
  "idempotency_key": "capability-selected:task_20260627_001",
  "data": {
    "task_id": "task_20260627_001",
    "capability_id": "repo.patch.codex",
    "capability_version": "v1",
    "selection_reason": "Matches a repository patch task that requires an isolated Codex worktree."
  }
}
