{
  "specversion": "1.0",
  "id": "evt_20260627_001",
  "source": "matrix://notyet.local/#agent-runtime/$evt_20260627_001",
  "type": "com.notyet.agent.worker.progress",
  "subject": "task_20260627_001",
  "time": "2026-06-27T04:00:00Z",
  "datacontenttype": "application/json",
  "workspace_id": "ws_carpet",
  "task_id": "task_20260627_001",
  "run_id": "run_20260627_001",
  "trace_id": "trace_20260627_001",
  "actor": {
    "type": "worker",
    "id": "worker_codex_001"
  },
  "created_at": "2026-06-27T04:00:00Z",
  "idempotency_key": "matrix:$evt_20260627_001",
  "data": {
    "message": "worker started"
  }
}
