{
  "specversion": "1.0",
  "id": "evt_20260627_018",
  "source": "runtime://memory-proposal-service",
  "type": "com.notyet.agent.memory.update.proposed",
  "subject": "task_20260627_001",
  "time": "2026-06-27T04:20:00Z",
  "datacontenttype": "application/json",
  "workspace_id": "ws_carpet",
  "task_id": "task_20260627_001",
  "trace_id": "trace_20260627_001",
  "actor": {
    "type": "runtime",
    "id": "memory_proposal_service"
  },
  "created_at": "2026-06-27T04:20:00Z",
  "idempotency_key": "memory-proposal:memory_proposal_20260627_001",
  "data": {
    "proposal_id": "memory_proposal_20260627_001",
    "proof_id": "proof_20260627_001",
    "scope": "repo:Carpet",
    "summary": "Record that Phase numbers and MCR ranges are separate planning axes.",
    "proposed_change": {
      "operation": "propose",
      "target": "memory:repo-planning-guidance",
      "statement": "For Carpet planning, verify the roadmap phase before choosing work by MCR range.",
      "rationale": "Proof showed MCR IDs are workstream buckets, not phase ordering."
    }
  }
}
