{
  "specversion": "1.0",
  "id": "evt_20260627_009",
  "source": "runtime://proof-ledger",
  "type": "com.notyet.agent.proof.submitted",
  "subject": "task_20260627_001",
  "time": "2026-06-27T04:12:00Z",
  "datacontenttype": "application/json",
  "workspace_id": "ws_carpet",
  "task_id": "task_20260627_001",
  "run_id": "run_20260627_001",
  "trace_id": "trace_20260627_001",
  "actor": {
    "type": "runtime",
    "id": "proof_ledger"
  },
  "created_at": "2026-06-27T04:12:00Z",
  "idempotency_key": "proof:proof_20260627_001",
  "data": {
    "proof_id": "proof_20260627_001",
    "artifact_refs": [
      {
        "kind": "patch",
        "uri": "https://object.local/artifacts/run_20260627_001.diff",
        "sha256": "aaaaaaaaaaaaaaaaaaaaaaaaaaaaaaaaaaaaaaaaaaaaaaaaaaaaaaaaaaaaaaaa"
      }
    ],
    "validation_summary": {
      "status": "passed",
      "command_count": 2,
      "passed_count": 2,
      "failed_count": 0,
      "summary": "Contract and schema validation passed."
    }
  }
}
